,full_text,start,end,technique,text,id,start_new,end_new,augmented_text,augmented_full_text
473,المقعد الفارغ لوزير الدفاع يثير الحزن في جلسة مجلس الوزراء,27,37,Loaded Language,يثير الحزن,1246050588368031744,27.0,37.0,هو حزينُ.,المقعد الفارغ لوزير الدفاع هو حزينُ. في جلسة مجلس الوزراء
476,شام الأحرار في مدينة ادلب يتظاهرون تأكيدا على عدم شرعية الأسد وانتخاباته لاشرعية للاسد وانتخاباته,7,14,Loaded Language,الأحرار,7072,4.0,11.0,الأحرار.,شام الأحرار. في مدينة ادلب يتظاهرون تأكيدا على عدم شرعية الأسد وانتخاباته لاشرعية للاسد وانتخاباته
477,وزارة الخارجية الأمريكية بلينكن بحث في اتصال مع وزير الخارجية السعودي جهود الحد من مخاطر اندلاع نزاع جديد في غزة الخليج أونلاين أمريكا السعودية,91,102,Loaded Language,اندلاع نزاع,7317,89.0,100.0,إندلاع الصراع.,وزارة الخارجية الأمريكية بلينكن بحث في اتصال مع وزير الخارجية السعودي جهود الحد من مخاطر إندلاع الصراع. جديد في غزة الخليج أونلاين أمريكا السعودية
480,إعلام العدو الطيران الحربي شن أكثر من غارة في ساعة واحدة على قطاع غزة غزة تحت القصف,78,91,Loaded Language,غزة تحت القصف,1393780937289252871,70.0,83.0,غزة قيد الترويض,إعلام العدو الطيران الحربي شن أكثر من غارة في ساعة واحدة على قطاع غزة غزة قيد الترويض
482,أطفال فلسطينيون يقفون فوق ركام منزل عائلة أبو حطب في قطاع غزة ويشعلون الشموع تنديدا بالمجزرة التي ارتكبتها إسرائيل بقتل من أفراد العائلة بينهم أطفال خلال الغارات الجوية على غزة,78,85,Loaded Language,تنديدا,7108,77.0,83.0,Tedexa.,أطفال فلسطينيون يقفون فوق ركام منزل عائلة أبو حطب في قطاع غزة ويشعلون الشموع Tedexa. بالمجزرة التي ارتكبتها إسرائيل بقتل من أفراد العائلة بينهم أطفال خلال الغارات الجوية على غزة
483,عين اليمن هذه دوله هادي باختصار فساد وسرقه ونهب ومحسوبيه لاتفرق عن مليشيا الحوثي بشي,32,57,Loaded Language,فساد وسرقه ونهب ومحسوبيه,1355223276621070337,32.0,56.0,الفساد، السرقة، النهب، الحساب.,عين اليمن هذه دوله هادي باختصار الفساد، السرقة، النهب، الحساب. لاتفرق عن مليشيا الحوثي بشي
485,إسرائيل تعلن تدمير نقطة مراقبة سورية في الجولان انتهكت سيادتها عاجل,13,18,Loaded Language,تدمير,1399801436351905793,13.0,18.0,! تم تدميره!,إسرائيل تعلن ! تم تدميره! نقطة مراقبة سورية في الجولان انتهكت سيادتها عاجل
486,مشهد مؤسف مجندة إسرائيلية تعتدي على سيدة فلسطينية أمام أعين أطفالها فلسطين هجوم أطفال,28,69,Loaded Language,تعتدي على سيدة فلسطينية أمام أعين أطفالها,1393915750361051138,26.0,67.0,الاعتداء على امرأة فلسطينية أمام عيون أطفالها.,مشهد مؤسف مجندة إسرائيلية الاعتداء على امرأة فلسطينية أمام عيون أطفالها. فلسطين هجوم أطفال
493,انتخبوا من دمرها لاشرعية للاسد وانتخاباته,11,17,Loaded Language,دمرها,7069,11.0,16.0,دمره تدميره.,انتخبوا من دمره تدميره. لاشرعية للاسد وانتخاباته
494,الحرب على سورية حملات تظليل مستمرة لمحاولة النيل من الشعب السوري عبر,49,54,Loaded Language,النيل,1270585163752316931,43.0,48.0,النيلين النيلين.,الحرب على سورية حملات تظليل مستمرة لمحاولة النيلين النيلين. من الشعب السوري عبر
497,شباب فلسطيني يمطرون قوات الاحتلال بالألعاب النارية في اشتباكات عند مخيم شعفاط,54,62,Loaded Language,اشتباكات,1394925798541471745,54.0,62.0,المواجهات الفصلية.,شباب فلسطيني يمطرون قوات الاحتلال بالألعاب النارية في المواجهات الفصلية. عند مخيم شعفاط
500,شام المجرم رفعت الاسد يشارك في مسرحية الانتخابات الرئاسية من السفارة السورية في باريس,6,12,Loaded Language,المجرم,7296,4.0,10.0,الجانى,شام الجانى رفعت الاسد يشارك في مسرحية الانتخابات الرئاسية من السفارة السورية في باريس
506,احتفالات بالنصر في غزة فيما سكانها يئنون تحت أنقاض الدمار الذي سببته صواريخ حماس العبثية الإرهابية والتي ارجعتهم سنوات إلى الوراء مضحك قال نصر قال نصر المهزومين,29,41,Loaded Language,سكانها يئنون,7073,28.0,40.0,شعبها يئن.,احتفالات بالنصر في غزة فيما شعبها يئن. تحت أنقاض الدمار الذي سببته صواريخ حماس العبثية الإرهابية والتي ارجعتهم سنوات إلى الوراء مضحك قال نصر قال نصر المهزومين
508,مراسلة فرانس انتشال ضحايا من عائلة كاملة قصف منزلها في شمال غزة ونزوح كبير,47,51,Loaded Language,قصف,1393098908218269697,41.0,44.0,,مراسلة فرانس انتشال ضحايا من عائلة كاملة  منزلها في شمال غزة ونزوح كبير
511,وارتياد المحلات والمجمعات التجارية والأسواق الشعبية في الأوقات المزدحمة حماية للنفس والأسرة والمجتمع من انتشار الوباء,118,125,Loaded Language,الوباء,1383043617644761095,111.0,117.0,الوباء.,وارتياد المحلات والمجمعات التجارية والأسواق الشعبية في الأوقات المزدحمة حماية للنفس والأسرة والمجتمع من انتشار الوباء.
517,الهيئة القيادية العليا لأسرى حماس تأجيل أو إلغاء الانتخابات سيكون له أثر خطير على شعبنا الفلسطيني وإيمانه بالاحتكام للعملية الديموقراطية,73,81,Loaded Language,أثر خطير,1386216744117735425,69.0,77.0,(أ) الأثر الخطير.,الهيئة القيادية العليا لأسرى حماس تأجيل أو إلغاء الانتخابات سيكون له (أ) الأثر الخطير. على شعبنا الفلسطيني وإيمانه بالاحتكام للعملية الديموقراطية
519,سوريا تفجيرات ومظاهرات في درعا احتجاجا على الانتخابات الرئاسية,8,24,Loaded Language,تفجيرات ومظاهرات,7303,6.0,22.0,المتفجرات والمظاهرات,سوريا المتفجرات والمظاهرات في درعا احتجاجا على الانتخابات الرئاسية
520,رصاص وقنابل الشبيحة يرعبون السكان خلال احتفالاتهم بمسرحية الانتخابات فيديو,0,11,Loaded Language,رصاص وقنابل,7065,0.0,11.0,الرصاصات والقنابل.,الرصاصات والقنابل. الشبيحة يرعبون السكان خلال احتفالاتهم بمسرحية الانتخابات فيديو
521,عاجل كتائب القس ام تعلن قصف مستوطنة كفار عزة وموقعي ناحل عوز و فجة العسكريين بقذائف الهاون,27,30,Loaded Language,قصف,1395048257542295552,24.0,27.0,,عاجل كتائب القس ام تعلن  مستوطنة كفار عزة وموقعي ناحل عوز و فجة العسكريين بقذائف الهاون
523,أزمة تيغراي السلطات الإثيوبية ترحل صحفيا في نيويورك تايمز بسبب تغطيته للحرب,73,76,Loaded Language,حرب,7306,72.0,75.0,الحرب.,أزمة تيغراي السلطات الإثيوبية ترحل صحفيا في نيويورك تايمز بسبب تغطيته للالحرب.
529,وزير الصحة اللبناني شهيدا وأكثر من آلاف جريح وعدد من المفقودين جراء انفجار مرفأ بيروت,77,84,Loaded Language,انفجار,1290762682384232448,68.0,74.0,إنفجار.,وزير الصحة اللبناني شهيدا وأكثر من آلاف جريح وعدد من المفقودين جراء إنفجار. مرفأ بيروت
530,لا حياد مع الكيان الصهيوني الحياد يعني تسليم رقابنا لهذا العدو المجرم المقاومة ثم المقاومة ثم المقاومة وهلق شو,52,64,Loaded Language,تسليم رقابنا,1394010173098893317,39.0,51.0,نسلّم أعناقنا.,لا حياد مع الكيان الصهيوني الحياد يعني نسلّم أعناقنا. لهذا العدو المجرم المقاومة ثم المقاومة ثم المقاومة وهلق شو
536,عاجل الشرطة الإسرائيلية تطلق النار على فلسطيني في مدينة القدس المحتلة بزعم محاولته تنفيذ عملية طعن,27,38,Loaded Language,تطلق النار,7112,24.0,34.0,! إطلق النار! إطلق النار! إطلق النار! إطلق النار!,عاجل الشرطة الإسرائيلية ! إطلق النار! إطلق النار! إطلق النار! إطلق النار! على فلسطيني في مدينة القدس المحتلة بزعم محاولته تنفيذ عملية طعن
538,قتل وأصيب مدنيا بينهم طفلا وامرأة بنيران ميليشيا الحوثي المدعومة إيرانيا في أقل من شهرين في مناطق الساحل الغربي اليمني العربية,0,11,Loaded Language,قتل وأصيب,7056,0.0,9.0,قتل وجرح.,قتل وجرح. مدنيا بينهم طفلا وامرأة بنيران ميليشيا الحوثي المدعومة إيرانيا في أقل من شهرين في مناطق الساحل الغربي اليمني العربية
539,نمور تهرب من حديقة سفاري في واحدة من أكبر مدن الصين والموظفون يدقون ناقوس الخطر بعد مرور أسبوع على الحادثة,77,82,Loaded Language,الخطر,1391994725557809152,74.0,79.0,خطر خطر خطر.,نمور تهرب من حديقة سفاري في واحدة من أكبر مدن الصين والموظفون يدقون ناقوس خطر خطر خطر. بعد مرور أسبوع على الحادثة
542,بوحسين حديث ولي العهد رئيس مجلس الوزراء حمل طموحات وطنية وخارطة طريق لنهضة رائدة,45,57,Loaded Language,طموحات وطنية,1365220109091020802,44.0,56.0,الطموحات القومية,بوحسين حديث ولي العهد رئيس مجلس الوزراء حمل الطموحات القومية وخارطة طريق لنهضة رائدة
543,صحيفة إسرائيلية الطائرة الإيرانية المفخخة تصعيد خطير ضد إسرائيل فلسطين,35,42,Loaded Language,المفخخة,1396117357731459076,34.0,41.0,الفخ.,صحيفة إسرائيلية الطائرة الإيرانية الفخ. تصعيد خطير ضد إسرائيل فلسطين
545,رؤساء البرلمانات العربية يطالبون بتدخل دولي عاجل لوضع حد نهائي لممارسات إسرائيل الإجرامية غير الإنسانية,81,104,Loaded Language,الإجرامية غير الإنسانية,1392575259711266821,80.0,103.0,-الجريمة الجنائية-اللاإنسانية-الجريمة الجنائية.,رؤساء البرلمانات العربية يطالبون بتدخل دولي عاجل لوضع حد نهائي لممارسات إسرائيل -الجريمة الجنائية-اللاإنسانية-الجريمة الجنائية.
548,وسائل إعلام إسرائيلية إصابة إسرائيلي بجراح خطيرة وآخر بجراح متوسطة جراء عملية طعن في القدس,38,49,Loaded Language,بجراح خطيرة,7111,37.0,48.0,جرحى بجروح خطيرة.,وسائل إعلام إسرائيلية إصابة إسرائيلي جرحى بجروح خطيرة. وآخر بجراح متوسطة جراء عملية طعن في القدس
561,معركة إسرائيل عبر الإنترنت تتراجع كيف نجح الفلسطينيون في نشر روايتهم وتفنيد مزاعم الاحتلال,79,84,Loaded Language,مزاعم,7088,76.0,81.0,المتظاهرات,معركة إسرائيل عبر الإنترنت تتراجع كيف نجح الفلسطينيون في نشر روايتهم وتفنيد المتظاهرات الاحتلال
564,صدمة في تركيا بعد هذا القرار الروسي المفاجئ,0,4,Loaded Language,صدمة,1382094652975804426,0.0,4.0,صعقة. صعقة.,صعقة. صعقة. في تركيا بعد هذا القرار الروسي المفاجئ
571,التحام من النهر إلى البحر جميع مقاهي جادة الكرمل في مدينة حيفا المحتلة تغلق أبوابها في يوم إضراب فلسطين رشاد العمري,0,31,Loaded Language,التحام من النهر إلى البحر,1394538137527980033,0.0,25.0,من النهر إلى البحر الإنصهار.,من النهر إلى البحر الإنصهار. جميع مقاهي جادة الكرمل في مدينة حيفا المحتلة تغلق أبوابها في يوم إضراب فلسطين رشاد العمري
574,كاميرات مراقبة تظهر تحرش عناصر الشرطة الإسرائيلية بشاب فلسطيني من دون سبب والاعتداء عليه في أثناء اعتقالها شابا آخر,20,24,Loaded Language,تحرش,7106,20.0,24.0,المضايقات.,كاميرات مراقبة تظهر المضايقات. عناصر الشرطة الإسرائيلية بشاب فلسطيني من دون سبب والاعتداء عليه في أثناء اعتقالها شابا آخر
581,وزير خارجية النرويج السابق للجزيرة اتهامات إسرائيل للمحكمة الجنائية الدولية بمعاداة السامية مقلقة بشكل بالغ,93,108,Loaded Language,مقلقة بشكل بالغ,1399878431119003653,92.0,107.0,4 - يُقلل بشدة.,وزير خارجية النرويج السابق للجزيرة اتهامات إسرائيل للمحكمة الجنائية الدولية بمعاداة السامية 4 - يُقلل بشدة.
582,قتلى وجرحى برصاص ميليشيات الأسد احتفالا ب الانتخابات,0,10,Loaded Language,قتلى وجرحى,7344,0.0,10.0,قتل وجرح.,قتل وجرح. برصاص ميليشيات الأسد احتفالا ب الانتخابات
584,خبير يعتبر اختبار الأسلحة الروسية الحديثة على أجساد السوريين خطوة طبيعية,18,25,Loaded Language,الأسلحة,7066,18.0,25.0,الأسلحة التي يحملها,خبير يعتبر اختبار الأسلحة التي يحملها الروسية الحديثة على أجساد السوريين خطوة طبيعية
589,كورونا ثم إعصار مدمر مصائب الهند لا تأتي فرادى شاهد سكاي فيديو,17,21,Loaded Language,مدمر,7062,16.0,20.0,تم تدميره.,كورونا ثم إعصار تم تدميره. مصائب الهند لا تأتي فرادى شاهد سكاي فيديو
594,المرأة لا تنتهك الأعراف او كرامتها حين تبادر رجلا بحبها,10,15,Loaded Language,تنتهك,1311345274367991813,10.0,15.0,يُنتَهِجُ.,المرأة لا يُنتَهِجُ. الأعراف او كرامتها حين تبادر رجلا بحبها
601,صقيع قطبي وعواصف ثلجية تجتاح الولايات المتحدة,23,28,Loaded Language,تجتاح,1362066504334929920,23.0,28.0,-إنّه تجاوز حدوديّة.,صقيع قطبي وعواصف ثلجية -إنّه تجاوز حدوديّة. الولايات المتحدة
607,حاتم المليكي النائب المستقل بمجلس نواب الشعب الحوار تعمل في لإنقاذ تونس من الفوضى,65,72,Loaded Language,لإنقاذ,1346431164857380871,60.0,66.0,-للإنقاذ. -للإنقاذ.,حاتم المليكي النائب المستقل بمجلس نواب الشعب الحوار تعمل في -للإنقاذ. -للإنقاذ. تونس من الفوضى
609,محكمة في القدس تنظر بقرار طرد عائلات من سلوان لصالح مستوطنين وسط احتجاجات,26,36,Loaded Language,طرد عائلات,7319,26.0,36.0,العائلات المبسرة.,محكمة في القدس تنظر بقرار العائلات المبسرة. من سلوان لصالح مستوطنين وسط احتجاجات
613,مجموعة رينو سجلت خسارة تاريخية قدرها مليارات يورو في العام,17,30,Loaded Language,خسارة تاريخية,1362717058262323200,17.0,30.0,الخسارة التاريخية.,مجموعة رينو سجلت الخسارة التاريخية. قدرها مليارات يورو في العام
617,الناطق باسم كتائب القسام للصهاينة احشدوا ما شئتم فقد أعددنا لكم أصنافا من الموت ستجعلكم تلعنون أنفسكم,66,83,Loaded Language,أصنافا من الموت,1392790941770133507,64.0,79.0,-أشكال الوفاة.,الناطق باسم كتائب القسام للصهاينة احشدوا ما شئتم فقد أعددنا لكم -أشكال الوفاة. ستجعلكم تلعنون أنفسكم
618,روسيا تعاود تسويق الكذب وتتهم تحرير الشام و الخوذ البيضاء بالتحضير لاستفزاز كيماوي مزعوم,88,93,Loaded Language,مزعوم,7070,83.0,88.0,وادعي في هذا الشأن.,روسيا تعاود تسويق الكذب وتتهم تحرير الشام و الخوذ البيضاء بالتحضير لاستفزاز كيماوي وادعي في هذا الشأن.
630,الغارديان انفجار أصفهان في إيران كان بمصنع للطائرات المسيرة ومرتبط بتهديدات إسرائيل العربية,70,78,Loaded Language,بتهديدات,1396518541776596993,67.0,75.0,بالتهديدات.,الغارديان انفجار أصفهان في إيران كان بمصنع للطائرات المسيرة ومرتبط بالتهديدات. إسرائيل العربية
643,بايدن العقوبات الأمريكية على بيلاروس قيد التنفيذ,7,15,Loaded Language,العقوبات,7328,6.0,14.0,لجنة من طراز SISS,بايدن لجنة من طراز SISS الأمريكية على بيلاروس قيد التنفيذ
650,أطفال فلسطينيون يقفون فوق ركام منزل عائلة أبو حطب في قطاع غزة ويشعلون الشموع تنديدا بالمجزرة التي ارتكبتها إسرائيل بقتل من أفراد العائلة بينهم أطفال خلال الغارات الجوية على غزة,161,168,Loaded Language,الغارات,7108,154.0,161.0,المداهمات.,أطفال فلسطينيون يقفون فوق ركام منزل عائلة أبو حطب في قطاع غزة ويشعلون الشموع تنديدا بالمجزرة التي ارتكبتها إسرائيل بقتل من أفراد العائلة بينهم أطفال خلال المداهمات. الجوية على غزة
655,الناطق باسم القوة الوطنية المتحركة سليم قشوط مفاوضات تجري بين أعيان مدينتي صرمان و صبراتة وقادة قوات حكومة الوفاق لتسليم مدنهم وحقن الدماء,133,143,Loaded Language,حقن الدماء,7349,128.0,138.0,حقن في حقن الدم.,الناطق باسم القوة الوطنية المتحركة سليم قشوط مفاوضات تجري بين أعيان مدينتي صرمان و صبراتة وقادة قوات حكومة الوفاق لتسليم مدنهم وحقن في حقن الدم.
657,وزير الخارجية الكويتي يجب التعاطي بحزم مع الاحتلال الإسرائيلي ومحاسبته على ممارساته,26,29,Loaded Language,يجب,1397885446856884229,22.0,25.0,يجب عليك ذلك، يجب عليك ذلك.,وزير الخارجية الكويتي يجب عليك ذلك، يجب عليك ذلك. التعاطي بحزم مع الاحتلال الإسرائيلي ومحاسبته على ممارساته
659,شباب فلسطيني يمطرون قوات الاحتلال بالألعاب النارية في اشتباكات عند مخيم شعفاط,13,19,Loaded Language,يمطرون,1394925798541471745,13.0,19.0,هم يَكُونونَ مطرونَ.,شباب فلسطيني هم يَكُونونَ مطرونَ. قوات الاحتلال بالألعاب النارية في اشتباكات عند مخيم شعفاط
667,ترامب يتهم رئيس كوريا الجنوبية بنهب الولايات المتحدة عين ليبيا,35,38,Loaded Language,نهب,1385928868628942849,32.0,35.0,-التشغيل. -التشغيل.,ترامب يتهم رئيس كوريا الجنوبية ب-التشغيل. -التشغيل. الولايات المتحدة عين ليبيا
669,ماذا يحدث في إيران حرائق وانفجارات وقتلى في ظروف غامضة,27,35,Loaded Language,انفجارات,1400323810042187779,26.0,34.0,إنفجارات.,ماذا يحدث في إيران حرائق وإنفجارات. وقتلى في ظروف غامضة
673,حبابك عشرة تحية أهل الكرم و الجود أهلنا في السودان الكريم لا يضام و شدة و تزول يا زول,53,58,Loaded Language,أهلنا,1303021364106887170,34.0,39.0,آباء آباءنا.,حبابك عشرة تحية أهل الكرم و الجود آباء آباءنا. في السودان الكريم لا يضام و شدة و تزول يا زول
677,حكيم القروي في محاور فرنسا قد تكون مسرح جيل جديد من الجهاديين وهناك آلاف جهادي محتمل على أراضيها,56,65,Loaded Language,الجهاديين,1389148331381821441,52.0,61.0,الجهاديين.,حكيم القروي في محاور فرنسا قد تكون مسرح جيل جديد من الجهاديين. وهناك آلاف جهادي محتمل على أراضيها
682,الصحة العالمية النظام الصحي في غزة متدهور ونزوح ألفا من منازلهم يفرض تحديات كبيرة,36,42,Loaded Language,متدهور,1395682886767063044,35.0,41.0,مُتَنَمِيّة.,الصحة العالمية النظام الصحي في غزة مُتَنَمِيّة. ونزوح ألفا من منازلهم يفرض تحديات كبيرة
683,معبر رفح مصر تدخل اليوم آلية لغزة لإزالة آثار ركام العدوان وتسريع الإعمار,47,64,Loaded Language,آثار ركام العدوان,1400444519536017411,41.0,58.0,آثار العدوان العدوان الإسرائيلي,معبر رفح مصر تدخل اليوم آلية لغزة لإزالة آثار العدوان العدوان الإسرائيلي وتسريع الإعمار
684,فيضان النيل يحاصر القصر الجمهوري ومنزل حمدوك قتيل وانهيار آلاف المنازل والمنشآت السودان فيضان السودان,49,84,Loaded Language,قتيل وانهيار آلاف المنازل والمنشآت,1302880505399046144,45.0,79.0,- قتل وتدمير الآلاف من المنازل والمنشآت.,فيضان النيل يحاصر القصر الجمهوري ومنزل حمدوك - قتل وتدمير الآلاف من المنازل والمنشآت. السودان فيضان السودان
697,قائد حركة الجهاد شكر جهوده و إسماعيل هنية عده شهيدا من هو قاسم سليماني الذي قامت ميليشياته الطائفية بارتكاب مجازر مروعة بحق السوريين والعراقيين واليمنيين وشرد الملايين من العرب العربية,85,103,Loaded Language,ميليشياته الطائفية,7039,81.0,99.0,ميليشياته الطائفية,قائد حركة الجهاد شكر جهوده و إسماعيل هنية عده شهيدا من هو قاسم سليماني الذي قامت ميليشياته الطائفية بارتكاب مجازر مروعة بحق السوريين والعراقيين واليمنيين وشرد الملايين من العرب العربية
